{
  "$schema": "./contract.schema.json",
  "contract": {
    "id": "nix-ai-core-architecture", "version": "2.1.0", "status": "BINDING",
    "immutability": {"content_addressed": true, "mutation": "PROHIBITED", "successor": "NEW_SEMVER_AND_NEW_DIGEST"},
    "predecessor": {"id": "nix-ai-core", "version": "2.0.1", "sha256": "f3548fa489fbc9a09aacaaeb62381bbea65a175ca0fcf300b9d911b48c555f1a", "relationship": "PRESERVES_AND_DEEPENS_IMPLEMENTATION"},
    "target": {"repository": "AtonoRobotics/Nix-AI", "baseline_commit": "938a2203189bd285867436a57ff18c5e5c638c07"}
  },
  "scope": {
    "includes": ["deployed authority and effects behavior", "Authoritative State with PostgreSQL and Garage", "Runtime Coordination and recovery", "Attested Qualification Runs", "NixOS wiring, migration, rollback, and QEMU qualification"],
    "preserves": ["immutable V2.0.1 semantics and public habitat names", "protobuf over authenticated Unix sockets", "PostgreSQL as Authoritative State", "Garage behind the S3-compatible evidence seam", "default-deny authority and fail-closed recovery"],
    "excludes": ["synthetic acceptance evidence", "unused alternate implementations", "deployed bypass paths", "mutation of contracts/v2.0.1"]
  },
  "modules": [
    {"id": "MOD-AUTHORITY-EFFECTS", "name": "Authority and Effects", "interface": "Authenticated invocations enter one default-deny decision and durable effect lifecycle used by production and tests.", "implementation_owns": ["grant attenuation and revocation", "effect admission and idempotency", "attempt recording and reconciliation", "independent terminal classification"], "seam": "Authenticated transport hands complete invocations to authority and admitted proposals to effects.", "adapters": ["authenticated Unix transport", "provider transport", "Authoritative State"], "invariants": ["no unconditional allow path", "no dispatch before durable admission", "provider acknowledgement alone never proves completion", "production and adversarial tests cross the same interface"], "test_surface": "The deployed interface with real authority/effects implementations and substitutable adapters."},
    {"id": "MOD-STATE", "name": "Authoritative State", "interface": "Domain transactions commit objectives, wakes, activations, leases, replay, effects, packages, governed change, and evidence references atomically.", "implementation_owns": ["PostgreSQL migrations and transactions", "versions and fences", "command replay", "evidence integrity", "crash recovery and rollback state"], "seam": "Domain callers submit complete transitions; storage and transport remain internal.", "adapters": ["PostgreSQL", "Garage S3-compatible evidence storage", "authenticated Unix transport"], "invariants": ["PostgreSQL is the sole operational truth", "evidence is content addressed and independently verified", "replay and transition commit atomically", "stale fences and versions fail closed"], "test_surface": "The same transaction interface used by deployed runtime callers."},
    {"id": "MOD-RUNTIME", "name": "Runtime Coordination", "interface": "A durable objective advances or recovers without callers knowing roles, protocol ordering, response tokens, or filesystem conventions.", "implementation_owns": ["objective progression", "dependency readiness", "wake and activation recovery", "authority/effects sequencing", "response interpretation"], "seam": "Role transports adapt deployed processes to one coordination interface.", "adapters": ["scheduler transport", "authority transport", "execution transport", "context transport", "effects transport"], "invariants": ["coordination never bypasses state or authority", "restart does not duplicate effects", "dependency failure prevents readiness", "role strings are deployment configuration"], "test_surface": "Objective progression and interruption recovery through the production interface."},
    {"id": "MOD-QUALIFICATION", "name": "Attested Qualification Run", "interface": "A caller requests complete qualification and receives digest-bound observations and artifacts or a fail-closed result.", "implementation_owns": ["source and closure hashing", "command execution", "artifact capture", "attestation", "gate verification", "release aggregation"], "seam": "Execution is substitutable internally while evidence meaning and verification remain fixed.", "adapters": ["local process execution", "Nix build execution", "QEMU execution"], "invariants": ["one canonical source digest", "no caller-supplied pass booleans", "artifacts bind command, source, closure, and digest", "release evidence comes from the exact tree"], "test_surface": "Complete attested runs through the production release interface."}
  ],
  "requirements": [
    {"id": "ARCH-001", "shall": "Every deployed authority decision crosses MOD-AUTHORITY-EFFECTS; unconditional authorization is absent.", "owner_module": "MOD-AUTHORITY-EFFECTS", "owner_packet": "A02", "evidence": ["authority adversarial report", "deployed-path conformance"], "acceptance": "Unauthorized and expired invocations are denied through the deployed entrypoint."},
    {"id": "ARCH-002", "shall": "Every external effect crosses durable admission, attempt recording, reconciliation, and independent completion.", "owner_module": "MOD-AUTHORITY-EFFECTS", "owner_packet": "A02", "evidence": ["effect fault report", "provider replacement report"], "acceptance": "No unledgered dispatch, duplicate execution, blind retry, or premature completion."},
    {"id": "STATE-001", "shall": "One Authoritative State interface owns every production state transition.", "owner_module": "MOD-STATE", "owner_packet": "A01", "evidence": ["state architecture tests", "caller inventory"], "acceptance": "No caller selects among competing state owners."},
    {"id": "STATE-002", "shall": "Replay, transitions, fences, versions, and evidence references commit atomically and recover fail closed.", "owner_module": "MOD-STATE", "owner_packet": "A01", "evidence": ["crash matrix", "migration report", "backup restore report"], "acceptance": "Crash, stale fence/version, migration, and restore preserve invariants."},
    {"id": "STATE-003", "shall": "Garage behavior remains behind the S3-compatible adapter and PostgreSQL remains authoritative.", "owner_module": "MOD-STATE", "owner_packet": "A01", "evidence": ["Garage compatibility report", "tamper report"], "acceptance": "Put/get/digest/tamper/restart/reboot pass with least privilege."},
    {"id": "RUN-001", "shall": "MOD-RUNTIME owns objective progression, dependency readiness, and recovery.", "owner_module": "MOD-RUNTIME", "owner_packet": "A03", "evidence": ["coordination conformance", "interruption recovery"], "acceptance": "Production and tests use the same coordination interface."},
    {"id": "RUN-002", "shall": "Role and wire protocols remain in transport adapters.", "owner_module": "MOD-RUNTIME", "owner_packet": "A03", "evidence": ["transport conformance", "protocol leakage audit"], "acceptance": "Two adapters pass one conformance suite without changing MOD-RUNTIME."},
    {"id": "QUAL-001", "shall": "Work-packet and release qualification use one Attested Qualification Run implementation.", "owner_module": "MOD-QUALIFICATION", "owner_packet": "A04", "evidence": ["qualification parity", "hashing uniqueness audit"], "acceptance": "Callers share hashing, execution, attestation, and verification."},
    {"id": "QUAL-002", "shall": "Synthetic, stale, inherited, and tree-mismatched evidence fails closed.", "owner_module": "MOD-QUALIFICATION", "owner_packet": "A04", "evidence": ["negative evidence suite", "exact-tree verification"], "acceptance": "Forbidden evidence fails and fresh exact-tree evidence passes."},
    {"id": "DEPLOY-001", "shall": "NixOS production units invoke only the deep modules and prove live readiness dependencies.", "owner_module": "MOD-RUNTIME", "owner_packet": "A05", "evidence": ["deployment graph", "fresh boot", "readiness matrix"], "acceptance": "No bypass entrypoint; readiness requires PostgreSQL, Garage, authority, effects, and coordination."},
    {"id": "MIG-001", "shall": "Upgrade and rollback preserve durable state without lost work or duplicate effects.", "owner_module": "MOD-STATE", "owner_packet": "A05", "evidence": ["migration report", "rollback report", "cross-generation recovery"], "acceptance": "State, evidence, fences, replay, and exactly-once outcomes survive upgrade and rollback."},
    {"id": "VERIFY-001", "shall": "Qualify the complete production path from one clean exact tree and closure in fresh QEMU.", "owner_module": "MOD-QUALIFICATION", "owner_packet": "A06", "evidence": ["static validation", "Rust tests", "Python tests", "clean regeneration", "QEMU end-to-end", "release manifest"], "acceptance": "Every gate passes from fresh non-synthetic evidence bound to one source and closure."}
  ],
  "work_packets": [
    {"id": "A00", "deliverable": "immutable V2.1.0 package", "requirements": ["VERIFY-001"], "cannot_begin": [], "cannot_integrate": [], "cannot_pass": [], "gates": ["G-CONTRACT"]},
    {"id": "A01", "deliverable": "deep Authoritative State", "requirements": ["STATE-001", "STATE-002", "STATE-003"], "cannot_begin": ["A00"], "cannot_integrate": [], "cannot_pass": ["A00"], "gates": ["G-STATE"]},
    {"id": "A02", "deliverable": "deployed Authority and Effects", "requirements": ["ARCH-001", "ARCH-002"], "cannot_begin": ["A00", "A01"], "cannot_integrate": [], "cannot_pass": ["A00", "A01"], "gates": ["G-AUTH-EFFECT"]},
    {"id": "A03", "deliverable": "deep Runtime Coordination", "requirements": ["RUN-001", "RUN-002"], "cannot_begin": ["A00", "A01", "A02"], "cannot_integrate": [], "cannot_pass": ["A00", "A01", "A02"], "gates": ["G-RUNTIME"]},
    {"id": "A04", "deliverable": "deep Attested Qualification Run", "requirements": ["QUAL-001", "QUAL-002"], "cannot_begin": ["A00"], "cannot_integrate": ["A01", "A02", "A03"], "cannot_pass": ["A00", "A01", "A02", "A03"], "gates": ["G-QUALIFICATION"]},